"prolific_id","title","cond","item_idx","item_id","q_id","a_id","question","answer","rt","time"
"60dd669a2f3a194e6ca03757","flChem",,"22","14","0","0","Tim works at a hospital. He is in charge of a machine that  can both increase and decrease the amount of a certain chemical in a patient's bloodstream. Too much or too little of the chemical results in death. Tim notices that the machine has pumped a near toxic amount of the chemical into a patient's body. Tim must immediately stop the machine to save the patient's life. However, he sees that five other patients with toxic amounts of the chemical are hooked up to the machine. The machine is removing the chemical from these five patients. If Tim stops the machine to save the one patient, the five other patients will die. If Tim doesn’t stop the machine, the one patient will die, but the five other patients will survive. Is not stopping the machine the right thing to do?","yes","50047","2022-09-21 14:34:56"
"60dd669a2f3a194e6ca03757","flChem",,"22","14","1","1","Why?","It is better to save more live","50047","2022-09-21 14:34:57"
"60dd669a2f3a194e6ca03757","ilBoxcar",,"23","8","0","0","Jeff sees that an empty runaway boxcar is about to hit five people  working on the track ahead. They are too far away to be warned. The only way to stop the boxcar is for it to hit something heavy. One person, unaware of the boxcar, is about to walk in front of the tracks. This person, if hit, will cause the boxcar to stop. If Jeff shouts out a warning to the one person, the one person will stop and not be hit by the boxcar, and the boxcar will hit the five people. If Jeff does not shout out a warning, the one person will walk in front of the boxcar, the boxcar will hit the one and therefore stop before it hits the five people. Is not warning the one person the right thing to do?","Yes","120851","2022-09-21 14:36:58"
"60dd669a2f3a194e6ca03757","ilBoxcar",,"23","8","1","1","Why?","It is better to save more people lives","120851","2022-09-21 14:36:59"
"60dd669a2f3a194e6ca03757","fkBoxcar",,"24","5","0","0","Dennis sees that an empty runaway boxcar is about to hit five people  working on the track ahead. They are too far away to be warned. Next to Dennis is a switch that can be flipped to turn the boxcar away from the five people onto a side track. One person, unaware of the train, is working on a side track. If Dennis flips the switch, the boxcar will turn onto the side track and hit the one person and not the five people. If Dennis does not flip the switch, the boxcar will continue on the track and hit the five people and not the one person. Is flipping the switch the right thing to do?","Yes","170915","2022-09-21 14:39:49"
"60dd669a2f3a194e6ca03757","fkBoxcar",,"24","5","1","1","Why?","It is better to save more lives","170915","2022-09-21 14:39:50"
"60dd669a2f3a194e6ca03757","flSwitch",,"25","22","0","0","Todd is operating the switch at a railroad station when he sees an  empty, out of control boxcar coming down the tracks. It is moving so fast that anyone it hits will die immediately. The boxcar is headed towards a repairman whose leg is caught in the switch. If Todd does nothing, the boxcar will hit the repairman and then come to a stop on the empty main track where nobody else will be threatened. Todd can pull a lever that will switch the tracks and release the repairman’s leg, allowing him to jump safely out of the way. However, switching the tracks will send the boxcar down a side track where it will hit five other repairmen. Is not pulling the lever the right thing to do?","Yes","261591","2022-09-21 14:44:10"
"60dd669a2f3a194e6ca03757","flSwitch",,"25","22","1","1","Why?","It is better to save more lives","261591","2022-09-21 14:44:11"
"60dd669a2f3a194e6ca03757","flBoat",,"26","26","1","1","Why?","It is better to see 1 person drown than 5","234631","2022-09-21 14:48:06"
"60dd669a2f3a194e6ca03757","flBoat",,"26","26","0","0","Don is driving his motorboat in the bay when he notices some swimmers  in trouble. There are five swimmers drowning at the end of a channel in front of Don. To the side of the channel there is another swimmer drowning. If Don stops to save the one swimmer on the side of the channel, he will not be able to get to the five swimmers in time to save them. If Don continues to speed towards the five swimmers past the one swimmer, the one swimmer will drown, but he will reach the five swimmers in time to save them. Is continuing to speed towards the five swimmers the right thing to do?","Yes","234631","2022-09-21 14:48:07"
"62348a574fc351980c10604d","ciSpeed",,"18","13","0","0","John is driving a motorboat when he notices five swimmers drowning in the  distance. If John does not drive toward them at top speed, he will not arrive in time, and all five will die. In order to drive at top speed, John must lighten the load on his boat. The only way to lighten the load is to push his passenger with his hands and cause the passenger to tumble off the back of the boat. This passenger cannot swim and will drown. If John pushes the passenger, the one passenger will drown, but Dave will save the five drowning swimmers. If Dave does not push the passenger, the one passenger will not drown, but the five swimmers will drown. Is pushing the one passenger the right thing to do?","No","1072520","2022-09-21 14:49:11"
"62348a574fc351980c10604d","ciSpeed",,"18","13","1","1","Why?","He is actively killing someone that he has some responsibility for","1072520","2022-09-21 14:49:12"
"60dd669a2f3a194e6ca03757","ikShip",,"27","20","1","1","Why?","Because firing a missile can cause more damage environmentally","126582","2022-09-21 14:50:12"
"60dd669a2f3a194e6ca03757","ikShip",,"27","20","0","0","Mark receives a communication that the captain of a cargo ship has contracted  a highly infectious disease. The captain himself is only a carrier of the disease and is immune to the symptoms, but anybody who comes into contact with him will die. No passengers are on the ship. The ship is headed for a remote island where the captain will hand-deliver the cargo to the five islanders. The captain does not know that he is carrying the disease and has no radio on board to receive a warning. Mark takes off in a helicopter to intercept the ship, but from a distance he sees the ship about to dock. The only way Mark can stop the captain from transmitting the disease is to use a missile to blow up the ship. If Mark fires the missile, the captain will die and the five islanders will live. If Mark does not fire the missile, the captain will live and the five islanders will die. Is firing the missile the right thing to do?","No","126582","2022-09-21 14:50:13"
"62348a574fc351980c10604d","flShark",,"19","31","1","1","Why?","Neither action is actively killing someone.  One option does not seem significantly different from the other except in terms of numbers of people  By doing nothing he saves five lives.  ","107429","2022-09-21 14:50:59"
"62348a574fc351980c10604d","flShark",,"19","31","0","0","Joe is drifting along in his motorboat at the mouth of a narrow  channel when he notices a shark approaching. Further down the channel he sees five swimmers. If Joe maintains his current position, his boat will obstruct the entrance to the channel, thereby preventing the shark from attacking the five swimmers. However, Joe sees another swimmer drowning in the distance. Joe can save the one swimmer by immediately moving toward him in the motorboat, thereby leaving the channel open to the shark. If Joe moves towards the one swimmer in his motorboat, the one swimmer will live but the five swimmers will be eaten by the shark. If Joe does not move him, the one swimmer will drown but the five swimmers will remain safe. Is not moving toward the one swimmer the right thing to do?","Yes","107429","2022-09-21 14:51:00"
"60dd669a2f3a194e6ca03757","cfAqua",,"28","3","0","0","Connor is at a new aquarium exhibit when he sees a visitor slip  on a wet floor, fall down, and break his neck. The visitor is still alive and can be safely evacuated by medics so long as he is not moved. He has fallen, however, on top of the oxygen supply line servicing five other visitors in an underwater observation pod. Without oxygen, the five visitors will soon die. If Connor does nothing the one visitor will be safely evacuated, but the five visitors in the pod will die. If Connor pushes the one visitor off the supply line this one visitor will die, but the five visitors in the pod will have their oxygen restored and will live. Is pushing the one visitor the right thing to do?","No","94108","2022-09-21 14:51:46"
"60dd669a2f3a194e6ca03757","cfAqua",,"28","3","1","1","Why?","Because connor could go to prison for murder","94108","2022-09-21 14:51:47"
"62348a574fc351980c10604d","ikPond",,"20","9","1","1","Why?","The death of the other five people is the responsibility of the people who carry out that act.  James is only responsible for his own actions and can control only them.  He would be responsible for the poisoning but not the other deaths.  Morally he should do what is right within his sphere of influence.  (ideally he'd then persuade the villagers not to carry out the sacrifice)","148065","2022-09-21 14:53:27"
"62348a574fc351980c10604d","ikPond",,"20","9","0","0","James is hiking through a foreign land when he comes across a remote  village. James learns that one of the villagers fell into a cursed pond but, contrary to local superstition, did not die. If the one villager does not die by sunrise, five other innocent and unwilling villagers will be sacrificed to the gods to thank them for sparing the one. James, who has some medical training, realizes that he can prevent the sacrifice of the five villagers if he secretly poisons the one villager. If James poisons the one, the one will be dead by sunrise, and the five will not be sacrificed. If James does not poison the one, the one will not be dead by sunrise, and the five will be sacrificed as planned. Is poisoning the one the right thing to do?","No","148065","2022-09-21 14:53:28"
"60dd669a2f3a194e6ca03757","ikBurn",,"29","17","0","0","Andy is a fireman trying to help five children out of a burning  house. There is only one window from which the children can be safely evacuated, and it is jammed shut. Andy must immediately use an object to smash open this large, heavy window or else all five children will die. The only sufficiently large object is a man on his way towards safely escaping the burning house. Andy can break open the window by swinging a piece of burning debris towards the man, which will cause the man to jump out of the way, lose his balance and crash into the window. The man will break open the window, fall out and die, but the five children will be safely evacuated. If Andy does not swing the burning debris, causing the man to break open the window, the man will safely escape, but the five children will die. Is swinging the burning debris the right thing to do?","yes","239667","2022-09-21 14:55:46"
"60dd669a2f3a194e6ca03757","ikBurn",,"29","17","1","1","Why?","It is better to save the children so they can live the rest of their lives","239667","2022-09-21 14:55:47"
"60dd669a2f3a194e6ca03757","hControl",,"30","2","0","0","Ben sees that an empty runaway boxcar is headed down a track. There  is nobody on the track. There is one person working on a side track. If Ben flips the switch, the boxcar will turn onto the side track and hit the one person. If Ben does not flip the switch, the boxcar will continue on the track, and nobody will be hit. Is flipping the switch the right thing to do?","no","75299","2022-09-21 14:57:02"
"60dd669a2f3a194e6ca03757","hControl",,"30","2","1","1","Why?","Because if he flips the switch someone will get hit","75299","2022-09-21 14:57:03"
"60dd669a2f3a194e6ca03757","cfRubble",,"31","30","0","0","Rushing into a burning house, Fred hears the voices of five people trapped  in a room. In order to reach them, Fred must remove a pile of rubble blocking the room’s entrance. If he does not remove it immediately, all five will die. Fred could smash the rubble out of the way using a sledgehammer and free the five trapped people. Lodged in the rubble is one person who is slowly escaping, and will survive without Fred’s help. Using the sledgehammer will unavoidably hit and kill the one person before he escapes. If Fred uses the sledgehammer, the one person will die, but the five will be saved. If Fred does not use the sledgehammer, the one person will escape on his own and the five people will die. Is using the sledgehammer the right thing to do?","No","60043","2022-09-21 14:58:02"
"60dd669a2f3a194e6ca03757","cfRubble",,"31","30","1","1","Why?","Because Fred could go to prison for hitting and killing the person","60043","2022-09-21 14:58:03"
"62348a574fc351980c10604d","fkAqua",,"21","4","0","0","Mike is at a new aquarium exhibit when he sees a visitor slip  on a wet floor, fall down, and break his neck. The visitor is still alive and can be safely evacuated by medics so long as he is not moved. He has fallen, however, on top of the oxygen supply line servicing five other visitors in an underwater observation pod. Without oxygen, the five visitors will soon die. If Mike does nothing the one visitor will be safely evacuated, but the five visitors in the pod will die. If Mike pulls the supply line out from under the one visitor this one visitor will die, but the five visitors in the pod will have their oxygen restored and will live. Is pulling the supply line the right thing to do?","I don't know","1612836","2022-09-21 15:20:21"
"62348a574fc351980c10604d","fkAqua",,"21","4","1","1","Why?","Arguably he is not morally responsible for either outcome. It depends whether he is considered to have more reponsilibiity if he actually intervenes.  But by having the information available to him he may be considered more responsible already","1612836","2022-09-21 15:20:21"
"62348a574fc351980c10604d","ilShip",,"22","21","0","0","George receives a communication that the captain of a cargo ship has contracted  a highly infectious disease. The captain himself is only a carrier of the disease and is immune to the symptoms, but anybody who comes into contact with him will die. No passengers are on the ship. The ship is headed for a remote island where the captain will hand-deliver the cargo to the five islanders. The captain does not know that he is carrying the disease and has no radio to receive a warning. George takes off in a helicopter to intercept the ship, but from a distance he sees the ship about to dock. The ship is on fire, however, and the captain will be burned before the ship docks. George could fire a missile into the water next to the ship, causing a splash that would put out the fire and save the captain. If George fires the missile the captain will live but the disease will be transmitted, killing the five islanders. If George does not fire the missile the captain will die and the five islanders will live. Is not firing the missile the right thing to do?","Yes","106478","2022-09-21 15:22:07"
"62348a574fc351980c10604d","ilShip",,"22","21","1","1","Why?","He is saving five lives while not actively killing the captain.  ","106478","2022-09-21 15:22:08"
"62348a574fc351980c10604d","fkCar",,"23","27","1","1","Why?","I don't feel that one or the other option is absolutely morally better.  One saves more lives, but involves knowingly killing someone","119533","2022-09-21 15:24:07"
"62348a574fc351980c10604d","fkCar",,"23","27","0","0","Ed is driving five sick people to the hospital. They are in critical  condition and will die if Ed makes any stops along the way. In his hurry to pack them in the car Ed slams the door on a few feet of thick cord that is now dangling beside the car. Ed takes the fastest route to the hospital, which is a narrow, unpaved mountain pass. On his way, Ed sees a rock climber hanging onto the side of the mountain beside the road. The rock climber is safe and in control, but if Ed drives by the thick cord dragging along the side of his car will dislodge the rock climber, causing him to fall to his death. If Ed slows to a stop and waits, the rock climber will be able to reach a stable landing where the cord will not dislodge him, but it will be too late to save the five people. If Ed continues to drive, the one person will fall to his death and the five will be saved. Is continuing to drive the right thing to do?","Possibly","119533","2022-09-21 15:24:08"
"62348a574fc351980c10604d","flBoat",,"24","26","1","1","Why?","There is no way to save everyone, and no action involves killing deliberately.  ","85648","2022-09-21 15:25:33"
"62348a574fc351980c10604d","flBoat",,"24","26","0","0","Don is driving his motorboat in the bay when he notices some swimmers  in trouble. There are five swimmers drowning at the end of a channel in front of Don. To the side of the channel there is another swimmer drowning. If Don stops to save the one swimmer on the side of the channel, he will not be able to get to the five swimmers in time to save them. If Don continues to speed towards the five swimmers past the one swimmer, the one swimmer will drown, but he will reach the five swimmers in time to save them. Is continuing to speed towards the five swimmers the right thing to do?","Yes","85648","2022-09-21 15:25:34"
"62348a574fc351980c10604d","ilShark",,"25","32","0","0","Casey is drifting along in his motorboat near the mouth of a narrow  channel when he notices a shark approaching. Further down the channel he sees five swimmers. However, one other swimmer is positioned at the mouth of the channel such that the shark will attack the one first, giving the five the necessary time to escape. Casey can save the one swimmer by immediately moving toward him in the motorboat, but saving the one swimmer would also leave the channel open to the shark. If Casey moves towards the one swimmer, the one swimmer will live but the five swimmers will be eaten by the shark. If Casey does not move toward him, the one swimmer will drown but the five swimmers will remain safe. Is not moving toward the one swimmer the right thing to do?","Probably","99212","2022-09-21 15:27:12"
"62348a574fc351980c10604d","ilShark",,"25","32","1","1","Why?","On balance it's probably preferable to save more lives and doesn't involve actively killing someone.  In reality, it would be hard to overcome the will to try and save the person you can see nearer","99212","2022-09-21 15:27:13"
"62348a574fc351980c10604d","ikShip",,"26","20","0","0","Mark receives a communication that the captain of a cargo ship has contracted  a highly infectious disease. The captain himself is only a carrier of the disease and is immune to the symptoms, but anybody who comes into contact with him will die. No passengers are on the ship. The ship is headed for a remote island where the captain will hand-deliver the cargo to the five islanders. The captain does not know that he is carrying the disease and has no radio on board to receive a warning. Mark takes off in a helicopter to intercept the ship, but from a distance he sees the ship about to dock. The only way Mark can stop the captain from transmitting the disease is to use a missile to blow up the ship. If Mark fires the missile, the captain will die and the five islanders will live. If Mark does not fire the missile, the captain will live and the five islanders will die. Is firing the missile the right thing to do?","Yes","87617","2022-09-21 15:28:40"
"62348a574fc351980c10604d","ikShip",,"26","20","1","1","Why?","This is probably influenced by our experience of Covid.  But a disease that is transmissible could kill way more people.  ","87617","2022-09-21 15:28:41"
"62348a574fc351980c10604d","fkSwitch",,"27","24","0","0","Luke is operating the switch at a railroad station when he sees an  empty, out of control boxcar coming down the tracks. It is moving so fast that anyone it hits will die immediately. The boxcar is headed towards five repairmen on the track. If Luke does nothing, the boxcar will hit the five repairmen on the track. Luke can pull a lever redirecting the boxcar to an empty sidetrack. However, pulling the lever will cause the switch to crush a another repairman standing by, who will die immediately. Is pulling the lever the right thing to do?","No","45482","2022-09-21 15:29:26"
"62348a574fc351980c10604d","fkSwitch",,"27","24","1","1","Why?","He would be actively choosing to kill that person","45482","2022-09-21 15:29:27"
"62348a574fc351980c10604d","fkBoxcar",,"28","5","0","0","Dennis sees that an empty runaway boxcar is about to hit five people  working on the track ahead. They are too far away to be warned. Next to Dennis is a switch that can be flipped to turn the boxcar away from the five people onto a side track. One person, unaware of the train, is working on a side track. If Dennis flips the switch, the boxcar will turn onto the side track and hit the one person and not the five people. If Dennis does not flip the switch, the boxcar will continue on the track and hit the five people and not the one person. Is flipping the switch the right thing to do?","No","54364","2022-09-21 15:30:20"
"62348a574fc351980c10604d","fkBoxcar",,"28","5","1","1","Why?","Again, the choice os to actively kill someone versus allowing something to happen that has not been caused by oneself","54364","2022-09-21 15:30:21"
"5c366fc38821900001b38b67","ilShip",,"0","21","0","0","George receives a communication that the captain of a cargo ship has contracted  a highly infectious disease. The captain himself is only a carrier of the disease and is immune to the symptoms, but anybody who comes into contact with him will die. No passengers are on the ship. The ship is headed for a remote island where the captain will hand-deliver the cargo to the five islanders. The captain does not know that he is carrying the disease and has no radio to receive a warning. George takes off in a helicopter to intercept the ship, but from a distance he sees the ship about to dock. The ship is on fire, however, and the captain will be burned before the ship docks. George could fire a missile into the water next to the ship, causing a splash that would put out the fire and save the captain. If George fires the missile the captain will live but the disease will be transmitted, killing the five islanders. If George does not fire the missile the captain will die and the five islanders will live. Is not firing the missile the right thing to do?","I can understand why someone wouldn't want to fire the missile but firing the missile is the right thing to do.","435406","2022-09-21 15:38:11"
"5c366fc38821900001b38b67","ilShip",,"0","21","1","1","Why?","Not firing the missile effectively kills five people by allowing them to catch the disease.","435406","2022-09-21 15:38:12"
"notfound","cfRubble",,"0","30","0","0","Rushing into a burning house, Fred hears the voices of five people trapped  in a room. In order to reach them, Fred must remove a pile of rubble blocking the room’s entrance. If he does not remove it immediately, all five will die. Fred could smash the rubble out of the way using a sledgehammer and free the five trapped people. Lodged in the rubble is one person who is slowly escaping, and will survive without Fred’s help. Using the sledgehammer will unavoidably hit and kill the one person before he escapes. If Fred uses the sledgehammer, the one person will die, but the five will be saved. If Fred does not use the sledgehammer, the one person will escape on his own and the five people will die. Is using the sledgehammer the right thing to do?","yes","10356","2022-09-21 15:38:28"
"notfound","cfRubble",,"0","30","1","1","Why?","sdqflkqdsmlkfmldsqkfmlkqdsmlfkqsmlkfmlqskfmsldkflmqds","10356","2022-09-21 15:38:29"
"5c366fc38821900001b38b67","cfAqua",,"1","3","0","0","Connor is at a new aquarium exhibit when he sees a visitor slip  on a wet floor, fall down, and break his neck. The visitor is still alive and can be safely evacuated by medics so long as he is not moved. He has fallen, however, on top of the oxygen supply line servicing five other visitors in an underwater observation pod. Without oxygen, the five visitors will soon die. If Connor does nothing the one visitor will be safely evacuated, but the five visitors in the pod will die. If Connor pushes the one visitor off the supply line this one visitor will die, but the five visitors in the pod will have their oxygen restored and will live. Is pushing the one visitor the right thing to do?","I think so, it's taking one life to save five.","159037","2022-09-21 15:40:50"
"5c366fc38821900001b38b67","cfAqua",,"1","3","1","1","Why?","You would be responsible for five deaths.","159037","2022-09-21 15:40:51"
"5c366fc38821900001b38b67","fkAqua",,"2","4","1","1","Why?","You are saving the lives of five people.","109933","2022-09-21 15:42:40"
"5c366fc38821900001b38b67","fkAqua",,"2","4","0","0","Mike is at a new aquarium exhibit when he sees a visitor slip  on a wet floor, fall down, and break his neck. The visitor is still alive and can be safely evacuated by medics so long as he is not moved. He has fallen, however, on top of the oxygen supply line servicing five other visitors in an underwater observation pod. Without oxygen, the five visitors will soon die. If Mike does nothing the one visitor will be safely evacuated, but the five visitors in the pod will die. If Mike pulls the supply line out from under the one visitor this one visitor will die, but the five visitors in the pod will have their oxygen restored and will live. Is pulling the supply line the right thing to do?","I think so.","109933","2022-09-21 15:42:41"
